	Anchor 1	Anchor 2	Alternative 1.1	Alternative 1.2	Correct Alternative	ID	# Votes out of 5 for Correct Alternative	style type
89	"It is the oldest long-distance trail in the United States,Long Trail - Green Mountain Club - Long Trail, Vermont, Hiking, Vermont Hiking  constructed between 1910 and 1930 by the Green Mountain Club.
"	"Em is the oldest long-distance trail in the United States,Long Trail - Green Mountain Club - Long Trail, Vermont, Hiking, Vermont Hiking  constructed between 1910 and 1930 by the Green Mountain Club.
"	"Under the laws of most jurisdictions, a business is not permitted to carry words like a bank, insurance, national in their name, unless em holds a corresponding license.
"	"Under the laws of most jurisdictions, a business is not permitted to carry words like a bank, insurance, national in their name, unless it holds a corresponding license.
"	2	QQ_em-subj-pronoun-89-sae-89_sae-189-em-subj-pronoun-189--1	-	em-subj-pronoun
90	"Em is part of a two-part series, the conclusion of the story being offered in Second Genesis.
"	"It is part of a two-part series, the conclusion of the story being offered in Second Genesis.
"	"Em drew on extensive DNA-DNA hybridisation studies to reassess the relationships between modern birds.
"	"It drew on extensive DNA-DNA hybridisation studies to reassess the relationships between modern birds.
"	1	QQ_sae-90-em-subj-pronoun-90_sae-190-em-subj-pronoun-190--0	-	em-subj-pronoun
91	"Portrayed by Robert O'Reilly, he is the leader of the Klingon Empire, known as the Chancellor.
"	"Portrayed by Robert O'Reilly, em is the leader of the Klingon Empire, known as the Chancellor.
"	"Em is the oldest provincial achievement of arms in Canada, and the oldest British coat of arms in use outside Great Britain.
"	"It is the oldest provincial achievement of arms in Canada, and the oldest British coat of arms in use outside Great Britain.
"	2	QQ_em-subj-pronoun-91-sae-91_sae-191-em-subj-pronoun-191--1	-	em-subj-pronoun
92	"Em usually designates a party ideologically based on liberalism.
"	"It usually designates a party ideologically based on liberalism.
"	"It shared the world with dinosaurs.
"	"Em shared the world with dinosaurs.
"	2	QQ_sae-92-em-subj-pronoun-92_em-subj-pronoun-192-sae-192--1	-	em-subj-pronoun
93	"It lived in Transylvania the same time as some of the last dinosaurs and was a member of the extinct order of Multituberculata.
"	"Em lived in Transylvania the same time as some of the last dinosaurs and was a member of the extinct order of Multituberculata.
"	"It was a member of the extinct order of Multituberculata, and lived during the Mesozoic, also known as the ""age of the dinosaurs.
"	"Em was a member of the extinct order of Multituberculata, and lived during the Mesozoic, also known as the ""age of the dinosaurs.
"	1	QQ_em-subj-pronoun-93-sae-93_em-subj-pronoun-193-sae-193--0	-	em-subj-pronoun
94	"In American service em captured a number of British vessels.
"	"In American service she captured a number of British vessels.
"	"Em has no biomedical basis, lacks clinical meaningfulness, and is categorized as pseudoscientific by leading chiropractic authorities.
"	"It has no biomedical basis, lacks clinical meaningfulness, and is categorized as pseudoscientific by leading chiropractic authorities.
"	1	QQ_sae-94-em-subj-pronoun-94_sae-194-em-subj-pronoun-194--0	-	em-subj-pronoun
95	"Em is a key plot development in J.
"	"It is a key plot development in J.
"	"Em drew on extensive DNA-DNA hybridisation studies to reassess the relationships between modern birds.
"	"It drew on extensive DNA-DNA hybridisation studies to reassess the relationships between modern birds.
"	1	QQ_sae-95-em-subj-pronoun-95_sae-195-em-subj-pronoun-195--0	-	em-subj-pronoun
96	"Em was an assembly entirely nominated by Oliver Cromwell and the Army's Council of Officers.
"	"It was an assembly entirely nominated by Oliver Cromwell and the Army's Council of Officers.
"	"It resembles a hamster or owl-like creature and went through a period of being a ""must-have"" toy following its holiday season launch, with continual sales until 2000.
"	"Em resembles a hamster or owl-like creature and went through a period of being a ""must-have"" toy following its holiday season launch, with continual sales until 2000.
"	2	QQ_sae-96-em-subj-pronoun-96_em-subj-pronoun-196-sae-196--1	-	em-subj-pronoun
97	"In Latin America, em is also a common diminutive for the given name Beatriz, the Spanish form of the Latin name Beatrix and the English name Beatrice.
"	"In Latin America, it is also a common diminutive for the given name Beatriz, the Spanish form of the Latin name Beatrix and the English name Beatrice.
"	"Em was Goldman's most successful thriller novel, and his second suspense novel.
"	"It was Goldman's most successful thriller novel, and his second suspense novel.
"	1	QQ_sae-97-em-subj-pronoun-97_sae-197-em-subj-pronoun-197--0	-	em-subj-pronoun
98	" It is a specific type of privilege escalation.
"	" Em is a specific type of privilege escalation.
"	"It's the most derived member of the order Multituberculata known from that locality, and shared the world with the much larger dinosaurs.
"	"Em's the most derived member of the order Multituberculata known from that locality, and shared the world with the much larger dinosaurs.
"	1	QQ_em-subj-pronoun-98-sae-98_em-subj-pronoun-198-sae-198--0	-	em-subj-pronoun
99	"Em coexisted with some of the late dinosaurs.
"	"It coexisted with some of the late dinosaurs.
"	"It was the world's first purpose-built bicameral parliament house.
"	"Em was the world's first purpose-built bicameral parliament house.
"	2	QQ_sae-99-em-subj-pronoun-99_em-subj-pronoun-199-sae-199--1	-	em-subj-pronoun
