	Anchor 1	Anchor 2	Alternative 1.1	Alternative 1.2	Correct Alternative	ID	# Votes out of 5 for Correct Alternative	style type
42	"It usually includes both powered and unpowered vehicles, for example locomotives, railroad cars, coaches, and wagons.
"	"Em usually includes both powered and unpowered vehicles, for example locomotives, railroad cars, coaches, and wagons.
"	" Em begins at Notchland, near Crawford Notch State Park, and follows a series of trails to the hamlet of Fabyans, then over Cherry Mountain to the town of Jefferson, over Mount Waumbek, along the Kilkenny Ridge Trail to Stark, through Nash Stream Forest to Dixville Notch, and north to the Connecticut Lakes and finally the Canada–US border at the southern edge of Quebec.
"	" It begins at Notchland, near Crawford Notch State Park, and follows a series of trails to the hamlet of Fabyans, then over Cherry Mountain to the town of Jefferson, over Mount Waumbek, along the Kilkenny Ridge Trail to Stark, through Nash Stream Forest to Dixville Notch, and north to the Connecticut Lakes and finally the Canada–US border at the southern edge of Quebec.
"	2	QQ_em-subj-pronoun-42-sae-42_sae-142-em-subj-pronoun-142--1	-	em-subj-pronoun
43	"It has an alphabetised title scheme covering all areas of law, drawing on authorities including Acts of the United Kingdom, Measures of the Welsh Assembly, UK case law and European law.
"	"Em has an alphabetised title scheme covering all areas of law, drawing on authorities including Acts of the United Kingdom, Measures of the Welsh Assembly, UK case law and European law.
"	"Its first section opened in 1863, making em the oldest underground metro system in the world – although in fact approximately 55% of the current network is above ground, as em generally runs on the surface in outlying suburbs.
"	"Its first section opened in 1863, making it the oldest underground metro system in the world – although in fact approximately 55% of the current network is above ground, as it generally runs on the surface in outlying suburbs.
"	2	QQ_em-subj-pronoun-43-sae-43_sae-143-em-subj-pronoun-143--1	-	em-subj-pronoun
44	"It drew on extensive DNA-DNA hybridisation studies to reassess the relationships between modern birds.
"	"Em drew on extensive DNA-DNA hybridisation studies to reassess the relationships between modern birds.
"	"Today it is the English city of Bath, Somerset.
"	"Today em is the English city of Bath, Somerset.
"	1	QQ_em-subj-pronoun-44-sae-44_em-subj-pronoun-144-sae-144--0	-	em-subj-pronoun
45	" Em is a natural generalization of the topology of the real numbers to arbitrary totally ordered sets.
"	" It is a natural generalization of the topology of the real numbers to arbitrary totally ordered sets.
"	" He is chief counsellor of the king, and the father of Laertes and Ophelia.
"	" Em is chief counsellor of the king, and the father of Laertes and Ophelia.
"	2	QQ_sae-45-em-subj-pronoun-45_em-subj-pronoun-145-sae-145--1	-	em-subj-pronoun
46	"It was a member of the also extinct order Multituberculata, and lived alongside of dinosaurs.
"	"Em was a member of the also extinct order Multituberculata, and lived alongside of dinosaurs.
"	"The show is produced by the public service broadcaster RTÉ, em first aired on RTÉ One on Monday 18 September 1989.
"	"The show is produced by the public service broadcaster RTÉ, it first aired on RTÉ One on Monday 18 September 1989.
"	2	QQ_em-subj-pronoun-46-sae-46_sae-146-em-subj-pronoun-146--1	-	em-subj-pronoun
47	"Em takes the interrupt number formatted as a byte value.
"	"It takes the interrupt number formatted as a byte value.
"	"Em drew on extensive DNA-DNA hybridisation studies to reassess the relationships between modern birds.
"	"It drew on extensive DNA-DNA hybridisation studies to reassess the relationships between modern birds.
"	1	QQ_sae-47-em-subj-pronoun-47_sae-147-em-subj-pronoun-147--0	-	em-subj-pronoun
48	"Em lived in what is now Mongolia during the late Campanian age of the Late Cretaceous Period, about 72 million years ago.
"	"It lived in what is now Mongolia during the late Campanian age of the Late Cretaceous Period, about 72 million years ago.
"	"Em also plays a part in confession among Anglicans and Methodists, in which em is a rite, as well as among other Protestants.
"	"It also plays a part in confession among Anglicans and Methodists, in which it is a rite, as well as among other Protestants.
"	1	QQ_sae-48-em-subj-pronoun-48_sae-148-em-subj-pronoun-148--0	-	em-subj-pronoun
49	"Ugly Rumours was the name of a rock band founded in part by former UK prime minister Tony Blair, while studying law at St John's College, Oxford during the early 1970s; em sang and played guitar
"	"Ugly Rumours was the name of a rock band founded in part by former UK prime minister Tony Blair, while studying law at St John's College, Oxford during the early 1970s; he sang and played guitar
"	"It drew on extensive DNA-DNA hybridisation studies to reassess the relationships between modern birds.
"	"Em drew on extensive DNA-DNA hybridisation studies to reassess the relationships between modern birds.
"	2	QQ_sae-49-em-subj-pronoun-49_em-subj-pronoun-149-sae-149--1	-	em-subj-pronoun
50	"He wrote it between November 1960 and March 1962.
"	"Em wrote it between November 1960 and March 1962.
"	"It is usually slung sash-style over the shoulder, with the ammunition pockets across the midriff and chest.
"	"Em is usually slung sash-style over the shoulder, with the ammunition pockets across the midriff and chest.
"	1	QQ_em-subj-pronoun-50-sae-50_em-subj-pronoun-150-sae-150--0	-	em-subj-pronoun
51	"It connects the Westerschelde and the Oosterschelde.
"	"Em connects the Westerschelde and the Oosterschelde.
"	"America was the first ship of the line built for the Continental Navy, but she never saw service there, being given to France after launching.
"	"America was the first ship of the line built for the Continental Navy, but em never saw service there, being given to France after launching.
"	1	QQ_em-subj-pronoun-51-sae-51_em-subj-pronoun-151-sae-151--0	-	em-subj-pronoun
52	"It operated services between three Finnish destinations as well as international flights to Tallinn.
"	"Em operated services between three Finnish destinations as well as international flights to Tallinn.
"	"It existed in the age immediately following the extinction of the last dinosaurs and was a member of the extinct order Multituberculata.
"	"Em existed in the age immediately following the extinction of the last dinosaurs and was a member of the extinct order Multituberculata.
"	1	QQ_em-subj-pronoun-52-sae-52_em-subj-pronoun-152-sae-152--0	-	em-subj-pronoun
53	"It was a member of the also extinct order Multituberculata and shared the world with the much larger dinosaurs.
"	"Em was a member of the also extinct order Multituberculata and shared the world with the much larger dinosaurs.
"	"It represented numerous artists and arts groups, the Brampton Arts Council encourages and recognizes excellence in the arts across the community.
"	"Em represented numerous artists and arts groups, the Brampton Arts Council encourages and recognizes excellence in the arts across the community.
"	1	QQ_em-subj-pronoun-53-sae-53_em-subj-pronoun-153-sae-153--0	-	em-subj-pronoun
54	"In the late 18th century a movement known as Romanticism began; it validated strong emotion as an authentic not of aesthetic experience, placing new emphasis on such emotions as trepidation, horror and terror and awe.
"	"In the late 18th century a movement known as Romanticism began; em validated strong emotion as an authentic not of aesthetic experience, placing new emphasis on such emotions as trepidation, horror and terror and awe.
"	"As it is typical of thermal power stations, heat is used to generate steam that drives a steam turbine connected to a generator that produces electricity.
"	"As em is typical of thermal power stations, heat is used to generate steam that drives a steam turbine connected to a generator that produces electricity.
"	1	QQ_em-subj-pronoun-54-sae-54_em-subj-pronoun-154-sae-154--0	-	em-subj-pronoun
55	"Em often grows in damp woods on lime substrates.
"	"It often grows in damp woods on lime substrates.
"	"  Em is a term of common speech, but may have more specific definitions in such fields as the law, medicine, research, and sexual relationships.
"	"  It is a term of common speech, but may have more specific definitions in such fields as the law, medicine, research, and sexual relationships.
"	1	QQ_sae-55-em-subj-pronoun-55_sae-155-em-subj-pronoun-155--0	-	em-subj-pronoun
56	"Em lived during the end of the Mesozoic, also known as the ""age of the dinosaurs"".
"	"It lived during the end of the Mesozoic, also known as the ""age of the dinosaurs"".
"	"A tower is a tall structure, taller than it is wide, often by a significant margin
"	"A tower is a tall structure, taller than em is wide, often by a significant margin
"	2	QQ_sae-56-em-subj-pronoun-56_em-subj-pronoun-156-sae-156--1	-	em-subj-pronoun
57	"It has many former stations, while others were planned but never formally opened for public use.
"	"Em has many former stations, while others were planned but never formally opened for public use.
"	"It was a member of the extinct order Multituberculata within the suborder Cimolodonta and family Cimolomyidae.
"	"Em was a member of the extinct order Multituberculata within the suborder Cimolodonta and family Cimolomyidae.
"	1	QQ_em-subj-pronoun-57-sae-57_em-subj-pronoun-157-sae-157--0	-	em-subj-pronoun
58	" Em can refer to:
"	" It can refer to:
"	" Em deeply affected every sector of the economy, and produced political upheaval that led to the realigning election of 1896 and the presidency of William McKinley.
"	" It deeply affected every sector of the economy, and produced political upheaval that led to the realigning election of 1896 and the presidency of William McKinley.
"	1	QQ_sae-58-em-subj-pronoun-58_sae-158-em-subj-pronoun-158--0	-	em-subj-pronoun
59	"It drew on extensive DNA-DNA hybridisation studies to reassess the relationships between modern birds.
"	"Em drew on extensive DNA-DNA hybridisation studies to reassess the relationships between modern birds.
"	"The total population of Turkey is 78,741,053 according to the 2015 estimate, making em the 19th most populated country in the world.
"	"The total population of Turkey is 78,741,053 according to the 2015 estimate, making it the 19th most populated country in the world.
"	2	QQ_em-subj-pronoun-59-sae-59_sae-159-em-subj-pronoun-159--1	-	em-subj-pronoun
60	"Em was a member of the extinct order Multituberculata within the suborder Cimolodonta, though its further affinities are unclear.
"	"It was a member of the extinct order Multituberculata within the suborder Cimolodonta, though its further affinities are unclear.
"	"The object is to force the other team to fail to hit the ball 'up' off the front wall, using any variety of wall or ledge combinations as long as the ball is played 'up' before it bounces twice.
"	"The object is to force the other team to fail to hit the ball 'up' off the front wall, using any variety of wall or ledge combinations as long as the ball is played 'up' before em bounces twice.
"	2	QQ_sae-60-em-subj-pronoun-60_em-subj-pronoun-160-sae-160--1	-	em-subj-pronoun
61	"Em includes the birds of Australia, New Zealand, Antarctica, and the surrounding ocean and subantarctic islands.
"	"It includes the birds of Australia, New Zealand, Antarctica, and the surrounding ocean and subantarctic islands.
"	" It is a particular example of a system in a steady state.
"	" Em is a particular example of a system in a steady state.
"	2	QQ_sae-61-em-subj-pronoun-61_em-subj-pronoun-161-sae-161--1	-	em-subj-pronoun
62	"It includes all the academic programs up to the level of a bachelor's degree.
"	"Em includes all the academic programs up to the level of a bachelor's degree.
"	"Em is principally white-bodied and smooth, rough or broken-coated but can be any colour.
"	"It is principally white-bodied and smooth, rough or broken-coated but can be any colour.
"	2	QQ_em-subj-pronoun-62-sae-62_sae-162-em-subj-pronoun-162--1	-	em-subj-pronoun
63	"Em is an emotion felt by a person whose social status, either by force or willingly, has just decreased.
"	"It is an emotion felt by a person whose social status, either by force or willingly, has just decreased.
"	"Em consists of a visual area containing some of the graphical user interface of the program em belongs to and is framed by a window decoration.
"	"It consists of a visual area containing some of the graphical user interface of the program it belongs to and is framed by a window decoration.
"	1	QQ_sae-63-em-subj-pronoun-63_sae-163-em-subj-pronoun-163--0	-	em-subj-pronoun
64	"Em is a member of the extinct order Multituberculata, within the suborder Cimolodonta and family Cimolomyidae.
"	"It is a member of the extinct order Multituberculata, within the suborder Cimolodonta and family Cimolomyidae.
"	"Em has consonants in at least eight, perhaps nine, basic places of articulation and 29 distinct fricatives, 27 sibilants, and 20 uvulars, more than any other documented language.
"	"It has consonants in at least eight, perhaps nine, basic places of articulation and 29 distinct fricatives, 27 sibilants, and 20 uvulars, more than any other documented language.
"	1	QQ_sae-64-em-subj-pronoun-64_sae-164-em-subj-pronoun-164--0	-	em-subj-pronoun
65	"While Stevens declared in 1990 that collusion was ""neither wide-spread nor institutionalised"", by April 2003 he acknowledged that he had uncovered collusion at a level ""way beyond"" his 1990 view.
"	"While Stevens declared in 1990 that collusion was ""neither wide-spread nor institutionalised"", by April 2003 em acknowledged that em had uncovered collusion at a level ""way beyond"" his 1990 view.
"	"It usually contains a small amount of anti-caking agent to prevent clumping and improve flow.
"	"Em usually contains a small amount of anti-caking agent to prevent clumping and improve flow.
"	1	QQ_em-subj-pronoun-65-sae-65_em-subj-pronoun-165-sae-165--0	-	em-subj-pronoun
66	"Em drew on extensive DNA-DNA hybridisation studies to reassess the relationships between modern birds.
"	"It drew on extensive DNA-DNA hybridisation studies to reassess the relationships between modern birds.
"	"Em was a member of the extinct order Multituberculata within the suborder Cimolodonta and superfamily Taeniolabidoidea.
"	"It was a member of the extinct order Multituberculata within the suborder Cimolodonta and superfamily Taeniolabidoidea.
"	1	QQ_sae-66-em-subj-pronoun-66_sae-166-em-subj-pronoun-166--0	-	em-subj-pronoun
67	" Em may refer to:
"	" It may refer to:
"	"Em puts the player in control of Captain Picard and his crew of the Enterprise D and features traditional point-and-click adventure gameplay as well as free-form space exploration, diplomatic encounters and tactical ship-to-ship combat.
"	"It puts the player in control of Captain Picard and his crew of the Enterprise D and features traditional point-and-click adventure gameplay as well as free-form space exploration, diplomatic encounters and tactical ship-to-ship combat.
"	1	QQ_sae-67-em-subj-pronoun-67_sae-167-em-subj-pronoun-167--0	-	em-subj-pronoun
68	"It was designed like other types of cruisers to operate as a long-range, independent warship, capable of defeating any ship apart from a battleship and fast enough to outrun any battleship it encountered.
"	"It was designed like other types of cruisers to operate as a long-range, independent warship, capable of defeating any ship apart from a battleship and fast enough to outrun any battleship em encountered.
"	"Established by Hugh Edwin Strickland in 1845, it contains the following species:
"	"Established by Hugh Edwin Strickland in 1845, em contains the following species:
"	1	QQ_em-subj-pronoun-68-sae-68_em-subj-pronoun-168-sae-168--0	-	em-subj-pronoun
69	"Em was a member of the extinct order of Multituberculata and belongs to the suborder Plagiaulacida and family Plagiaulacidae.
"	"It was a member of the extinct order of Multituberculata and belongs to the suborder Plagiaulacida and family Plagiaulacidae.
"	"It was a member of the also extinct order of Multituberculata.
"	"Em was a member of the also extinct order of Multituberculata.
"	2	QQ_sae-69-em-subj-pronoun-69_em-subj-pronoun-169-sae-169--1	-	em-subj-pronoun
70	"Em may refer to:
"	"It may refer to:
"	"It is an important component of the zooplankton, providing food for whales, fish and birds.
"	"Em is an important component of the zooplankton, providing food for whales, fish and birds.
"	2	QQ_sae-70-em-subj-pronoun-70_em-subj-pronoun-170-sae-170--1	-	em-subj-pronoun
71	"in other words, em is the product of some integer with itself.
"	"in other words, it is the product of some integer with itself.
"	"Em, ""is the means of answering directly the question 'How does em work?
"	"It, ""is the means of answering directly the question 'How does it work?
"	1	QQ_sae-71-em-subj-pronoun-71_sae-171-em-subj-pronoun-171--0	-	em-subj-pronoun
72	"It drew on extensive DNA-DNA hybridisation studies to reassess the relationships between modern birds.
"	"Em drew on extensive DNA-DNA hybridisation studies to reassess the relationships between modern birds.
"	"Established by Jean Cabanis in 1850, it contains the following species:
"	"Established by Jean Cabanis in 1850, em contains the following species:
"	1	QQ_em-subj-pronoun-72-sae-72_em-subj-pronoun-172-sae-172--0	-	em-subj-pronoun
73	"It includes the swans and true geese.
"	"Em includes the swans and true geese.
"	"It may refer to:
"	"Em may refer to:
"	1	QQ_em-subj-pronoun-73-sae-73_em-subj-pronoun-173-sae-173--0	-	em-subj-pronoun
74	"First published in 1895, it features five stories about Mowgli and three unrelated stories, all but one set in India, most of which Kipling wrote while living in Vermont.
"	"First published in 1895, em features five stories about Mowgli and three unrelated stories, all but one set in India, most of which Kipling wrote while living in Vermont.
"	"Em was a member of the extinct order Multituberculata and lived towards the end of the ""age of the dinosaurs.
"	"It was a member of the extinct order Multituberculata and lived towards the end of the ""age of the dinosaurs.
"	2	QQ_em-subj-pronoun-74-sae-74_sae-174-em-subj-pronoun-174--1	-	em-subj-pronoun
75	"Such methods update the learner so as to make em better fit the training data with each iteration.
"	"Such methods update the learner so as to make it better fit the training data with each iteration.
"	"It drew on extensive DNA-DNA hybridisation studies to reassess the relationships between modern birds.
"	"Em drew on extensive DNA-DNA hybridisation studies to reassess the relationships between modern birds.
"	2	QQ_sae-75-em-subj-pronoun-75_em-subj-pronoun-175-sae-175--1	-	em-subj-pronoun
76	"Assessed typically on the inhabitants of coastal areas of England, em was one of several taxes that English monarchs could levy by prerogative without the approval of Parliament.
"	"Assessed typically on the inhabitants of coastal areas of England, it was one of several taxes that English monarchs could levy by prerogative without the approval of Parliament.
"	"Em set and enforced the moral standards required to be followed in society.
"	"It set and enforced the moral standards required to be followed in society.
"	1	QQ_sae-76-em-subj-pronoun-76_sae-176-em-subj-pronoun-176--0	-	em-subj-pronoun
77	"Em has existed since the start of the Industrial Revolution.
"	"It has existed since the start of the Industrial Revolution.
"	"In its current meaning, it usually refers to secondary schools focused on preparing students to enter a university for advanced academic study.
"	"In its current meaning, em usually refers to secondary schools focused on preparing students to enter a university for advanced academic study.
"	2	QQ_sae-77-em-subj-pronoun-77_em-subj-pronoun-177-sae-177--1	-	em-subj-pronoun
78	"It is a highly interdisciplinary topic.
"	"Em is a highly interdisciplinary topic.
"	"It consists of lamb or mutton and onion, topped with sliced potatoes and baked in a heavy pot on a low heat.
"	"Em consists of lamb or mutton and onion, topped with sliced potatoes and baked in a heavy pot on a low heat.
"	1	QQ_em-subj-pronoun-78-sae-78_em-subj-pronoun-178-sae-178--0	-	em-subj-pronoun
79	"Hellerud was a borough of the city of Oslo, Norway up to January 1, 2004, when em became part of the new borough of Alna
"	"Hellerud was a borough of the city of Oslo, Norway up to January 1, 2004, when it became part of the new borough of Alna
"	"It has no legal standing but is used to dictate ceremonial protocol.
"	"Em has no legal standing but is used to dictate ceremonial protocol.
"	2	QQ_sae-79-em-subj-pronoun-79_em-subj-pronoun-179-sae-179--1	-	em-subj-pronoun
80	"Em has branch locations in Nonthaburi, on Bangkapi Road, and in Chiang Mai.
"	"It has branch locations in Nonthaburi, on Bangkapi Road, and in Chiang Mai.
"	"Public opinion consists of the desires, wants, and thinking of the majority of the people; it is the collective opinion of the people of a society or state on an issue or problem.
"	"Public opinion consists of the desires, wants, and thinking of the majority of the people; em is the collective opinion of the people of a society or state on an issue or problem.
"	2	QQ_sae-80-em-subj-pronoun-80_em-subj-pronoun-180-sae-180--1	-	em-subj-pronoun
81	" It does not, however, include any postcard without a pre-printed stamp.
"	" Em does not, however, include any postcard without a pre-printed stamp.
"	"It refers to a set of three different festivals: Rongali or Bohag Bihu observed in April, Kongali or Kati Bihu observed in October, and Bhogali or Magh Bihu observed in January.
"	"Em refers to a set of three different festivals: Rongali or Bohag Bihu observed in April, Kongali or Kati Bihu observed in October, and Bhogali or Magh Bihu observed in January.
"	1	QQ_em-subj-pronoun-81-sae-81_em-subj-pronoun-181-sae-181--0	-	em-subj-pronoun
82	"Em may refer to:
"	"It may refer to:
"	"Em drew on extensive DNA-DNA hybridisation studies to reassess the relationships between modern birds.
"	"It drew on extensive DNA-DNA hybridisation studies to reassess the relationships between modern birds.
"	1	QQ_sae-82-em-subj-pronoun-82_sae-182-em-subj-pronoun-182--0	-	em-subj-pronoun
83	"Em first appeared in issue 1,735, dated 18 October 1975.
"	"It first appeared in issue 1,735, dated 18 October 1975.
"	"It drew on extensive DNA-DNA hybridisation studies to reassess the relationships between modern birds.
"	"Em drew on extensive DNA-DNA hybridisation studies to reassess the relationships between modern birds.
"	2	QQ_sae-83-em-subj-pronoun-83_em-subj-pronoun-183-sae-183--1	-	em-subj-pronoun
84	"Em includes day-to-day care, selective breeding and the raising of livestock.
"	"It includes day-to-day care, selective breeding and the raising of livestock.
"	"Sogn was a district of the city of Oslo, Norway up to January 1, 2004, when em became part of the Nordre Aker district.
"	"Sogn was a district of the city of Oslo, Norway up to January 1, 2004, when it became part of the Nordre Aker district.
"	1	QQ_sae-84-em-subj-pronoun-84_sae-184-em-subj-pronoun-184--0	-	em-subj-pronoun
85	"It is solid at room temperature.
"	"Em is solid at room temperature.
"	"It follows the fortunes of an Australian rules football club over the course of a season, and explores the clashes of individuals from within the club.
"	"Em follows the fortunes of an Australian rules football club over the course of a season, and explores the clashes of individuals from within the club.
"	1	QQ_em-subj-pronoun-85-sae-85_em-subj-pronoun-185-sae-185--0	-	em-subj-pronoun
86	"Em is a subset of a set consisting of more than half of the set's elements.
"	"It is a subset of a set consisting of more than half of the set's elements.
"	"Em is the body of rules that organizes and regulates the rights and duties arising between individuals.
"	"It is the body of rules that organizes and regulates the rights and duties arising between individuals.
"	1	QQ_sae-86-em-subj-pronoun-86_sae-186-em-subj-pronoun-186--0	-	em-subj-pronoun
87	"It regulated some of the administration, judiciary and the military.
"	"Em regulated some of the administration, judiciary and the military.
"	"It is typically a cloud of partially ionized gas in which star formation has recently taken place, with a size ranging from one to hundreds of light years, and density from a few to about a million particles per cubic cm.
"	"Em is typically a cloud of partially ionized gas in which star formation has recently taken place, with a size ranging from one to hundreds of light years, and density from a few to about a million particles per cubic cm.
"	1	QQ_em-subj-pronoun-87-sae-87_em-subj-pronoun-187-sae-187--0	-	em-subj-pronoun
88	" It is a general term, without specific reference to particular taxa, life forms, structure, spatial extent, or any other specific botanical or geographic characteristics.
"	" Em is a general term, without specific reference to particular taxa, life forms, structure, spatial extent, or any other specific botanical or geographic characteristics.
"	"Em was a member of the extinct order of Multituberculata within the suborder Cimolodonta and possibly the family Cimolodontidae.
"	"It was a member of the extinct order of Multituberculata within the suborder Cimolodonta and possibly the family Cimolodontidae.
"	2	QQ_em-subj-pronoun-88-sae-88_sae-188-em-subj-pronoun-188--1	-	em-subj-pronoun
